<?xml version="1.0" encoding="UTF-8"?>
<!-- 
EJERCICIO 2 (1.5 PUNTOS)

Crea redsocial.dtd para que se valide el siguiente XML y cumpla con las restricciones indicadas a continuación.

RESTRICCIONES PARA EL DTD:
- Raíz: redSocial con atributo nombre obligatorio
- Puede haber de 1 a n usuarios.
- Cada usuario tiene:
    - Atributos: id obligatorio, rol (puede ser "admin", "usuario" o "invitado". Por defecto es "usuario")
    - Elementos en orden: nombre (obligatorio), email (obligatorio), telefono (opcional), seguidores (opcional), amigos (opcional)
    - amigos contiene 0-n elementos amigo vacíos, con atributo ref obligatorio.
    - telefono tiene atributo prefijo opcional

-->
<!DOCTYPE redSocial SYSTEM "redsocial.dtd">
<redSocial nombre="Conectados">
    <usuario id="U001" rol="admin">
        <nombre>Ana García</nombre>
        <email>ana@email.com</email>
        <telefono prefijo="+34">612345678</telefono>
        <seguidores>150</seguidores>
        <amigos>
            <amigo ref="U002"/>
        </amigos>
    </usuario>
    <usuario id="U002" rol="usuario">
        <nombre>Carlos López</nombre>
        <email>carlos@email.com</email>
        <telefono prefijo="+34">623456789</telefono>
        <seguidores>75</seguidores>
    </usuario>
</redSocial>